{
  "h2a_version": "0.1",
  "profile": "h2a-media",
  "grant_id": "3f2a1c40-0d1e-4b2a-9c33-8a1b2c3d4e5f",
  "likeness_ref": "urn:h2a:subject:jane-actor-001",
  "asset": {
    "asset_id": "asset-991",
    "media_type": "video",
    "content_hash": "sha256:bbbbbbbbbbbbbbbbbbbbbbbbbbbbbbbbbbbbbbbbbbbbbbbbbbbbbbbbbbbbbbbb",
    "c2pa_manifest_ref": "c2pa:urn:manifest:991"
  },
  "composition": [
    { "asset_ref": "asset-880", "grant_ref": "3f2a1c40-0d1e-4b2a-9c33-8a1b2c3d4e5f" }
  ],
  "constraints": { "no_singing_voice": true }
}
